{
  "$schema": "https://json-schema.org/draft/2020-12/schema",
  "$id": "https://schemas.parel.sh/v1/plugin-manifest.schema.json",
  "title": "PAREL Plugin Manifest",
  "description": "Public metadata for runtime plugins.",
  "type": "object",
  "required": ["name"],
  "properties": {
    "$schema": {
      "type": "string"
    },
    "name": {
      "type": "string",
      "minLength": 1
    },
    "version": {
      "type": "string",
      "minLength": 1
    },
    "description": {
      "type": "string"
    },
    "runtime": {
      "type": "string",
      "enum": ["edge", "nodejs"],
      "default": "edge",
      "description": "Where the plugin runs. \"edge\" (the default) loads it in the shared edge plugin runtime; \"nodejs\" opts into a Node.js sidecar host, for plugins with native or heavy runtime needs."
    },
    "type": {
      "type": "string",
      "enum": ["channel"],
      "description": "Set to \"channel\" for a channel connector package (its default export is a ChannelConnector)."
    },
    "channel": {
      "type": "object",
      "description": "Channel connector metadata, for packages with type \"channel\".",
      "properties": {
        "connectionTypes": {
          "type": "array",
          "items": { "enum": ["webhook", "managed_ws"] },
          "uniqueItems": true,
          "description": "Connection transports this connector supports."
        },
        "sources": {
          "type": "array",
          "items": { "type": "string" },
          "description": "Event sources this connector emits (e.g. \"slack.socket\")."
        }
      },
      "additionalProperties": false
    },
    "provides": {
      "type": "object",
      "properties": {
        "hooks": { "type": "boolean" },
        "tools": { "type": "boolean" },
        "normalize": {
          "type": "array",
          "items": { "type": "string" },
          "description": "Input types this plugin can normalize into transcript messages (e.g. \"async_callback\")."
        },
        "commands": {
          "type": "array",
          "items": { "type": "string", "pattern": "^[a-z][a-z0-9_-]*$" },
          "uniqueItems": true,
          "description": "Slash commands this plugin registers via ctx.command (e.g. \"compact\"). Declaration is authorization: hosts recognize /name only for declared names."
        },
        "capabilities": {
          "type": "array",
          "items": { "type": "string" }
        }
      },
      "additionalProperties": false
    },
    "requires": {
      "type": "object",
      "properties": {
        "plugins": {
          "type": "array",
          "items": { "type": "string" }
        },
        "capabilities": {
          "type": "array",
          "items": { "type": "string" }
        },
        "permissions": {
          "type": "object",
          "properties": {
            "network": { "type": "boolean" },
            "store": { "type": "boolean" },
            "model": { "type": "boolean" },
            "inputs": { "type": "boolean" }
          },
          "additionalProperties": false
        },
        "secrets": {
          "type": "object",
          "description": "Declares which config fields are secrets, keyed by field name (e.g. apiKey). Values are bound via ${NAME} references in the agent config and substituted by the host before setup; the declaration drives deploy-time literal rejection, required validation, and redaction.",
          "additionalProperties": {
            "type": "object",
            "required": ["description"],
            "properties": {
              "description": { "type": "string" },
              "required": { "type": "boolean", "default": true }
            },
            "additionalProperties": false
          }
        }
      },
      "additionalProperties": false
    },
    "consumes": {
      "type": "object",
      "description": "Opt-in consumption declarations. invocationContext:true lets this plugin receive the per-turn invocation context on its tool contexts (ToolHandlerContext). transcript:\"lazy\" declares that the plugin reads history through hookCtx.transcript by range instead of receiving the full messages array on every hook dispatch. Default off; declaring is treated as authorization. Design: docs/invocation-context.md, docs/transcript-reader.md.",
      "properties": {
        "invocationContext": { "type": "boolean" },
        "transcript": { "type": "string", "enum": ["lazy"] }
      },
      "additionalProperties": false
    },
    "config": {
      "type": "object",
      "additionalProperties": true
    },
    "execution": {
      "type": "object",
      "properties": {
        "snapshot": {
          "type": "object",
          "properties": {
            "store": {
              "type": "string",
              "enum": ["copy", "redact", "reset", "custom"]
            },
            "sandbox": {
              "type": "string",
              "enum": ["copy", "reset", "unsupported", "custom"]
            },
            "sideEffects": {
              "type": "string",
              "enum": ["reference", "require_approval", "deny_replay"]
            }
          },
          "additionalProperties": false
        }
      },
      "additionalProperties": false
    }
  },
  "additionalProperties": false
}
