{
  "$schema": "../../../schemas/plugin-manifest.schema.json",
  "name": "@parel/sandbox-e2b",
  "version": "0.0.10",
  "provides": {
    "capabilities": ["parel.sandbox", "filesystem", "exec", "process", "ports"]
  },
  "requires": {
    "permissions": {
      "network": true,
      "store": true
    },
    "secrets": {
      "apiKey": {
        "description": "E2B API key (e2b.dev -> Settings -> API Keys)",
        "required": true
      }
    }
  },
  "consumes": {
    "invocationContext": true
  },
  "config": {
    "template": "Optional E2B sandbox template name (defaults to \"base\").",
    "timeout": "Optional idle time in milliseconds before E2B reclaims the sandbox — deletes it, or pauses it with persistence (defaults to 300000). Each step's reconnect sets the timer back to at least this, and a long foreground command lengthens it to cover the command. Not a per-command timeout — see commandTimeout.",
    "sandboxId": "Optional id of an existing E2B sandbox managed outside PAREL (e.g. ${var:SANDBOX_ID}). The plugin only connects to it: a missing sandbox is an error, never replaced, and stop/session end never kill it.",
    "commandTimeout": "Optional per-command timeout in milliseconds for foreground commands (bash tool, exec/shell; defaults to 120000). A timed-out command returns exit code 124 instead of hanging the turn. Per-call timeoutMs overrides it.",
    "promoteAfterMs": "Optional sync-to-async promotion threshold for the bash tool (defaults to 0 = disabled, keeping the legacy foreground path). When set, bash launches detached with file-redirected output from t=0 and waits up to this many milliseconds for completion; a command still running past the threshold keeps running in the sandbox and the tool returns its processId, registered in the same store as processes.start, so the process tools (tail/list/stop) can follow up. Commands finishing inside the window return exactly as before. Recommended ~120000-300000.",
    "env": "Optional environment variables injected into the sandbox at cold-start, persistent across all commands."
  },
  "execution": {
    "snapshot": {
      "store": "reset",
      "sandbox": "reset",
      "sideEffects": "require_approval"
    }
  }
}
