{
  "$schema": "../../../schemas/plugin-manifest.schema.json",
  "name": "@parel/filesystem-tools",
  "version": "0.1.1",
  "description": "Workspace-relative file read, list, and write tools.",
  "provides": {
    "tools": true
  },
  "requires": {
    "capabilities": ["workspace", "filesystem"]
  },
  "execution": {
    "snapshot": {
      "store": "reset",
      "sideEffects": "require_approval"
    }
  }
}
