{
  "$schema": "../../../schemas/plugin-manifest.schema.json",
  "name": "@parel/approval-tools",
  "version": "0.2.0",
  "description": "Human approval request and check tools backed by session inputs.",
  "provides": {
    "tools": true,
    "normalize": ["async_callback"]
  },
  "requires": {
    "permissions": {
      "store": true
    }
  },
  "execution": {
    "snapshot": {
      "store": "reset",
      "sideEffects": "require_approval"
    }
  }
}
